{
  "slug": "mitgliederversammlung-2026",
  "publishDate": "2026-07-28",
  "category": "verein",
  "title": {
    "de": "Einladung zur Mitgliederversammlung",
    "ar": "دعوة إلى الجمعية العمومية",
    "en": "Invitation to the general meeting"
  },
  "body": {
    "de": "Samstag, 12. September, 15:00 Uhr im Gemeinschaftsraum. Tagesordnung und Jahresbericht liegen zwei Wochen vorher aus.",
    "ar": "السبت ١٢ سبتمبر الساعة ١٥:٠٠ في قاعة الجمعية. يُتاح جدول الأعمال والتقرير السنوي قبل الموعد بأسبوعين.",
    "en": "Saturday, 12 September, 3:00 pm in the community room. The agenda and annual report will be available two weeks in advance."
  }
}
