{
  "slug": "beetzsee-ausflug-jugend-2026",
  "publishDate": "2026-07-11",
  "category": "jugend-freizeit",
  "title": {
    "de": "Ausflug zum Beetzsee für Jugendliche",
    "ar": "رحلة الشباب إلى بحيرة بيتسزه",
    "en": "Youth outing to the Beetzsee"
  },
  "body": {
    "de": "Gemeinsamer Ausflug an den Beetzsee mit Grillen und Spielen. Treffpunkt ist der Parkplatz an der Moschee, Rückkehr am Abend.",
    "ar": "رحلة جماعية إلى بحيرة بيتسزه مع شواء وألعاب. نقطة اللقاء في موقف السيارات بجانب المسجد، والعودة في المساء.",
    "en": "A group outing to the Beetzsee lake with barbecue and games. Meeting point is the mosque car park, returning in the evening."
  }
}
