{
  "slug": "fruehjahrsputz-moschee-2026",
  "publishDate": "2026-05-10",
  "category": "verein",
  "title": {
    "de": "Frühjahrsputz in der Moschee",
    "ar": "تنظيف الربيع في المسجد",
    "en": "Spring cleaning at the mosque"
  },
  "body": {
    "de": "Am Samstagvormittag wird gemeinsam geputzt und aufgeräumt. Handschuhe und Putzmittel sind vorhanden, tatkräftige Hände willkommen.",
    "ar": "صباح السبت ننظّف ونرتّب المسجد معًا. القفازات ومواد التنظيف متوفرة، والأيدي المتطوعة مرحّب بها.",
    "en": "A joint clean-up and tidy morning on Saturday. Gloves and cleaning supplies are provided — helping hands welcome."
  }
}
