{
  "slug": "eid-al-adha-2026",
  "publishDate": "2026-08-15",
  "category": "eid",
  "pinnedUntil": "2026-08-21",
  "title": {
    "de": "Eid al-Adha-Gebet und Feier",
    "ar": "صلاة عيد الأضحى واحتفال",
    "en": "Eid al-Adha prayer and celebration"
  },
  "body": {
    "de": "Wir laden zum Eid al-Adha-Gebet am Morgen des Festtages ein. Die Türen öffnen früh, bitte kommen Sie rechtzeitig. Im Anschluss gibt es eine kleine Zusammenkunft mit Erfrischungen im Gemeinschaftsraum.",
    "ar": "ندعوكم لصلاة عيد الأضحى صباح يوم العيد. تُفتح الأبواب مبكرًا، يُرجى الحضور في الوقت المناسب. يلي الصلاة لقاء بسيط مع مرطبات في قاعة الجمعية.",
    "en": "Join us for the Eid al-Adha prayer on the morning of the feast. Doors open early; please arrive in good time. A small gathering with refreshments follows in the community room."
  }
}
