{
  "slug": "tarawih-ramadan-2026",
  "publishDate": "2026-08-04",
  "category": "ramadan",
  "pinnedUntil": "2027-02-18",
  "title": {
    "de": "Tarawih-Gebete beginnen am 17. Februar",
    "ar": "صلاة التراويح تبدأ في ١٧ فبراير",
    "en": "Tarawih prayers begin on 17 February"
  },
  "body": {
    "de": "Der erste Tarawih findet nach dem Ischa-Gebet statt. Die Türen öffnen 30 Minuten vorher. Für Familien ist der hintere Gebetsbereich reserviert.",
    "ar": "تُقام أول تراويح بعد صلاة العشاء، وتُفتح الأبواب قبلها بثلاثين دقيقة. القسم الخلفي مخصّص للعائلات.",
    "en": "The first Tarawih takes place after the Isha prayer. Doors open 30 minutes beforehand. The rear prayer area is reserved for families."
  }
}
