{
  "slug": "arabischunterricht-kinder-2026",
  "publishDate": "2026-07-19",
  "category": "unterricht",
  "title": {
    "de": "Anmeldung für den Arabischunterricht der Kinder",
    "ar": "التسجيل في دروس اللغة العربية للأطفال",
    "en": "Registration for children's Arabic lessons"
  },
  "body": {
    "de": "Samstags 10:00–12:00 Uhr, zwei Gruppen nach Alter. Anmeldung im Büro oder per E-Mail bis zum 30. August.",
    "ar": "أيام السبت من ١٠:٠٠ إلى ١٢:٠٠ في مجموعتين حسب العمر. التسجيل في المكتب أو بالبريد حتى ٣٠ أغسطس.",
    "en": "Saturdays 10:00am–12:00pm, two groups by age. Register at the office or by email by 30 August."
  }
}
